[
  {
    "en": "Emergency Department",
    "fr": "Urgence",
    "p": "K",
    "loc": "S2",
    "aliases": [
      "ER",
      "Emergency",
      "urgence",
      "urgences",
      "Urgence"
    ],
    "status": "official",
    "note": "Official JGH Emergency page: Pavilion K, level S2; Emergency entrance is 5777 Légaré."
  },
  {
    "en": "Care Unit (Acute Geriatrics)",
    "fr": "Unité de soins — Gériatrie aiguë",
    "p": "C",
    "loc": "6th floor",
    "aliases": [
      "Geriatrics inpatient",
      "Unité de soins — Gériatrie aiguë"
    ],
    "status": "verify",
    "note": "JGH Department List says one C6 geriatrics unit relocated to Hôtel-Dieu (HD-6) and also lists Geriatrics D6 in C-6. Confirm the patient's unit before routing."
  },
  {
    "en": "Care Unit (Antepartum / High Risk)",
    "fr": "Unité de soins — Grossesse à risque / antépartum",
    "p": "K",
    "loc": "3rd floor",
    "aliases": [
      "High-risk pregnancy",
      "Antepartum",
      "Unité de soins — Grossesse à risque / antépartum"
    ],
    "status": "verify",
    "note": "Directory/photo baseline — verify the exact room if appointment paperwork or current signage differs."
  },
  {
    "en": "Care Unit (Cardiovascular - CVU)",
    "fr": "Unité de soins cardiovasculaires (CVU)",
    "p": "K",
    "loc": "2nd floor",
    "aliases": [
      "CVU",
      "Cardiac unit",
      "Unité de soins cardiovasculaires (CVU)"
    ],
    "status": "verify",
    "note": "Directory/photo baseline — verify the exact room if appointment paperwork or current signage differs."
  },
  {
    "en": "Care Unit (Cardiovascular Intensive Care - CVICU)",
    "fr": "Soins intensifs cardiovasculaires (CVICU)",
    "p": "K",
    "loc": "2nd floor",
    "aliases": [
      "CVICU",
      "CCU",
      "cardiac intensive care",
      "Soins intensifs cardiovasculaires (CVICU)"
    ],
    "status": "verify",
    "note": "Directory/photo baseline — verify the exact room if appointment paperwork or current signage differs."
  },
  {
    "en": "Care Unit (Family Medicine CJ)",
    "fr": "Unité de soins de médecine familiale",
    "p": "C",
    "loc": "3rd floor",
    "aliases": [
      "Family Medicine inpatient",
      "Unité de soins de médecine familiale"
    ],
    "status": "verify",
    "note": "Directory/photo baseline — verify the exact room if appointment paperwork or current signage differs."
  },
  {
    "en": "Care Unit (Medicine C5)",
    "fr": "Unité de soins — Médecine C5",
    "p": "C",
    "loc": "5th floor",
    "aliases": [
      "C5",
      "Unité de soins — Médecine C5"
    ],
    "status": "verify",
    "note": "Directory/photo baseline — verify the exact room if appointment paperwork or current signage differs."
  },
  {
    "en": "Care Unit (Medical and Surgical Intensive Care - MSICU)",
    "fr": "Soins intensifs médicaux et chirurgicaux",
    "p": "K",
    "loc": "1st floor",
    "aliases": [
      "MSICU",
      "ICU",
      "intensive care",
      "Soins intensifs médicaux et chirurgicaux"
    ],
    "status": "official",
    "note": "Current Department List lists the Intensive Care Unit in Pavilion K, 1st floor."
  },
  {
    "en": "Care Unit (Medicine)",
    "fr": "Unité de soins — Médecine",
    "p": "K",
    "loc": "6th floor",
    "aliases": [
      "Medicine inpatient",
      "Unité de soins — Médecine"
    ],
    "status": "verify",
    "note": "Directory/photo baseline — verify the exact room if appointment paperwork or current signage differs."
  },
  {
    "en": "Care Unit (Medicine)",
    "fr": "Unité de soins — Médecine",
    "p": "K",
    "loc": "7th floor",
    "aliases": [
      "Medicine inpatient",
      "Unité de soins — Médecine"
    ],
    "status": "verify",
    "note": "Directory/photo baseline — verify the exact room if appointment paperwork or current signage differs."
  },
  {
    "en": "Care Unit (Mental Health and Addiction Unit)",
    "fr": "Unité de santé mentale et dépendance",
    "p": "B",
    "loc": "3rd floor",
    "aliases": [
      "Mental health",
      "addiction",
      "Unité de santé mentale et dépendance"
    ],
    "status": "verify",
    "note": "Directory/photo baseline — verify the exact room if appointment paperwork or current signage differs."
  },
  {
    "en": "Care Unit (Neonatal Intensive Care - NICU)",
    "fr": "Soins intensifs néonatals (USIN)",
    "p": "K",
    "loc": "5th floor",
    "aliases": [
      "NICU",
      "neonatal ICU",
      "Soins intensifs néonatals (USIN)"
    ],
    "status": "verify",
    "note": "Directory/photo baseline — verify the exact room if appointment paperwork or current signage differs."
  },
  {
    "en": "Care Unit (Neurosciences)",
    "fr": "Unité de soins — Neurosciences",
    "p": "K",
    "loc": "10th floor",
    "aliases": [
      "Neurosciences inpatient",
      "Unité de soins — Neurosciences"
    ],
    "status": "verify",
    "note": "Photo baseline says K, 10th floor; the current Department List separately lists Neuroscience at 4C. Confirm whether the visitor needs the inpatient unit or the department."
  },
  {
    "en": "Care Unit (Orthopedics)",
    "fr": "Unité de soins — Orthopédie",
    "p": "C",
    "loc": "4th floor",
    "aliases": [
      "Orthopedic inpatient",
      "Unité de soins — Orthopédie"
    ],
    "status": "verify",
    "note": "Directory/photo baseline — verify the exact room if appointment paperwork or current signage differs."
  },
  {
    "en": "Care Unit (Palliative Care)",
    "fr": "Unité de soins palliatifs",
    "p": "B",
    "loc": "4th floor",
    "aliases": [
      "Palliative inpatient",
      "Unité de soins palliatifs"
    ],
    "status": "verify",
    "note": "Directory/photo baseline — verify the exact room if appointment paperwork or current signage differs."
  },
  {
    "en": "Care Unit (Postpartum)",
    "fr": "Unité de soins post-partum",
    "p": "C/D",
    "loc": "8th floor",
    "aliases": [
      "Postpartum",
      "maternity after delivery",
      "Unité de soins post-partum"
    ],
    "status": "verify",
    "note": "Directory/photo baseline — verify the exact room if appointment paperwork or current signage differs."
  },
  {
    "en": "Care Unit (Psychiatry High and Intermediate Care Units)",
    "fr": "Psychiatrie — soins intensifs et intermédiaires",
    "p": "B",
    "loc": "3rd floor",
    "aliases": [
      "Psychiatry inpatient",
      "Psychiatrie — soins intensifs et intermédiaires"
    ],
    "status": "verify",
    "note": "Directory/photo baseline — verify the exact room if appointment paperwork or current signage differs."
  },
  {
    "en": "Care Unit (Surgery)",
    "fr": "Unité de soins — Chirurgie",
    "p": "K",
    "loc": "8th and 9th floors",
    "aliases": [
      "Surgery inpatient",
      "Unité de soins — Chirurgie"
    ],
    "status": "official",
    "note": "Current Department List lists Surgery in Pavilion K, 8th and 9th floors."
  },
  {
    "en": "Care Unit (Surgical Short Stay)",
    "fr": "Court séjour chirurgical",
    "p": "D",
    "loc": "5th floor",
    "aliases": [
      "Short stay surgery",
      "Court séjour chirurgical"
    ],
    "status": "verify",
    "note": "Directory/photo baseline — verify the exact room if appointment paperwork or current signage differs."
  },
  {
    "en": "Admitting Office and Patient Accounts",
    "fr": "Admissions et comptes des patients",
    "p": "B",
    "loc": "B-114",
    "aliases": [
      "Admissions",
      "Patient Accounts",
      "Admissions et comptes des patients"
    ],
    "status": "official",
    "note": "Directory/photo baseline — verify the exact room if appointment paperwork or current signage differs."
  },
  {
    "en": "Allergy and Immunology",
    "fr": "Allergie et immunologie",
    "p": "C",
    "loc": "C-204",
    "aliases": [
      "Allergy",
      "Immunology",
      "allergie",
      "immunologie",
      "Allergie et immunologie"
    ],
    "status": "official",
    "note": "Directory/photo baseline — verify the exact room if appointment paperwork or current signage differs."
  },
  {
    "en": "Anna & Peter Brojde Lung Cancer Centre",
    "fr": "Centre du cancer du poumon Anna & Peter Brojde",
    "p": "E",
    "loc": "7th floor",
    "aliases": [
      "Lung cancer",
      "Brojde",
      "Centre du cancer du poumon Anna & Peter Brojde"
    ],
    "status": "official",
    "note": "Current JGH Department List places the Peter Brojde Lung Cancer Centre in Pavilion E, 7th floor."
  },
  {
    "en": "Arthritis Clinic",
    "fr": "Clinique d’arthrite",
    "p": "C",
    "loc": "C-003.10",
    "aliases": [
      "Arthritis",
      "arthrite",
      "Clinique d’arthrite"
    ],
    "status": "official",
    "note": "Current JGH Clinics and Testing page lists Arthritis at C-003.10."
  },
  {
    "en": "Audiology",
    "fr": "Audiologie",
    "p": "E",
    "loc": "E-932",
    "aliases": [
      "Hearing",
      "audiologie",
      "audition",
      "Audiologie"
    ],
    "status": "official",
    "note": "Dedicated Audiology and Speech Pathology page: Audiology is E-932."
  },
  {
    "en": "Auditorium",
    "fr": "Auditorium",
    "p": "A",
    "loc": "A-102",
    "aliases": [
      "Auditorium"
    ],
    "status": "verify",
    "note": "Directory/photo baseline — verify the exact room if appointment paperwork or current signage differs."
  },
  {
    "en": "Auxiliary Office",
    "fr": "Bureau de l’Auxiliaire",
    "p": "A",
    "loc": "A-018",
    "aliases": [
      "Auxiliary",
      "Bureau de l’Auxiliaire"
    ],
    "status": "verify",
    "note": "Directory/photo baseline — verify the exact room if appointment paperwork or current signage differs."
  },
  {
    "en": "Breast Centre",
    "fr": "Centre du sein",
    "p": "E",
    "loc": "E-1004 (10th floor)",
    "aliases": [
      "Breast",
      "breast clinic",
      "sein",
      "mammographie",
      "Centre du sein"
    ],
    "status": "official",